{
  "schema_version": "0.1.0",
  "record_type": "execution_record",
  "run_id": "run-synthetic-001",
  "case_id": "synthetic-case",
  "asset_id": "asset-y20",
  "requested_interface": "open",
  "created_at": "2026-09-10T12:00:20Z",
  "data_classification": "private",
  "input_revisions": [
    {
      "kind": "hardware_model",
      "path": "cases/synthetic-case/derived/private/hardware-model.json",
      "revision": "sha256:hardware"
    },
    {
      "kind": "software_model",
      "path": "cases/synthetic-case/derived/private/components/y20/software-model.json",
      "revision": "sha256:software"
    },
    {
      "kind": "implementation_links",
      "path": "cases/synthetic-case/derived/private/components/y20/implementation-links.json",
      "revision": "sha256:links"
    },
    {
      "kind": "runtime_bindings",
      "path": "cases/synthetic-case/derived/private/components/y20/runtime-bindings.json",
      "revision": "sha256:bindings"
    }
  ],
  "started_at": "2026-09-10T12:00:10Z",
  "finished_at": "2026-09-10T12:00:19Z",
  "initial_state": {
    "mode_active": false,
    "open": false
  },
  "approval": {
    "approved_at": "2026-09-10T12:00:09Z",
    "scope": "Open asset-y20 for no more than five seconds and restore closed/off.",
    "maximum_duration_seconds": 5,
    "restore_target": "closed and operator mode inactive",
    "source_ref": "conversation:synthetic-approval"
  },
  "events": [
    {
      "timestamp": "2026-09-10T12:00:10Z",
      "kind": "read",
      "binding_id": "y20-open-state",
      "value": false,
      "outcome": "succeeded",
      "raw_evidence_ref": "cases/synthetic-case/raw/runtime/run-synthetic-001/event-001.json"
    },
    {
      "timestamp": "2026-09-10T12:00:11Z",
      "kind": "write",
      "binding_id": "y20-open-request",
      "value": true,
      "outcome": "succeeded",
      "raw_evidence_ref": "cases/synthetic-case/raw/runtime/run-synthetic-001/event-002.json"
    },
    {
      "timestamp": "2026-09-10T12:00:12Z",
      "kind": "runtime_observation",
      "outcome": "observed",
      "detail": "Logical open state became true.",
      "raw_evidence_ref": "cases/synthetic-case/raw/runtime/run-synthetic-001/event-003.json"
    },
    {
      "timestamp": "2026-09-10T12:00:16Z",
      "kind": "write",
      "binding_id": "y20-close-request",
      "value": true,
      "outcome": "succeeded",
      "raw_evidence_ref": "cases/synthetic-case/raw/runtime/run-synthetic-001/event-004.json"
    },
    {
      "timestamp": "2026-09-10T12:00:18Z",
      "kind": "restore",
      "outcome": "succeeded",
      "detail": "Closed state and inactive operator mode were observed.",
      "raw_evidence_ref": "cases/synthetic-case/raw/runtime/run-synthetic-001/event-005.json"
    }
  ],
  "timeouts": {
    "overall_seconds": 10,
    "triggered": false
  },
  "human_observations": [
    {
      "timestamp": "2026-09-10T12:00:13Z",
      "observation": "Operator reported visible opening movement.",
      "source_ref": "conversation:synthetic-observation"
    }
  ],
  "restore": {
    "attempted": true,
    "status": "verified",
    "evidence_refs": [
      "cases/synthetic-case/raw/runtime/run-synthetic-001/event-005.json"
    ]
  },
  "hypotheses": [
    {
      "id": "open-request",
      "statement": "The functional open request causes the component to open.",
      "status": "confirmed",
      "evidence_refs": [
        "cases/synthetic-case/raw/runtime/run-synthetic-001/event-003.json",
        "conversation:synthetic-observation"
      ]
    }
  ],
  "final_state": {
    "mode_active": false,
    "open": false
  },
  "execution_status": "succeeded",
  "resulting_assessment": "ready_for_supervised_probe"
}
