{
  "schema_version": "0.1.0",
  "record_type": "run_manifest",
  "run_id": "run-synthetic-001",
  "case_id": "synthetic-case",
  "asset_id": "asset-y20",
  "requested_interface": "open",
  "created_at": "2026-09-10T12:00:00Z",
  "data_classification": "private",
  "repository_revision": "a058a7f",
  "connection_profile": "synthetic_ads",
  "input_contracts": [
    {
      "kind": "hardware_model",
      "path": "cases/synthetic-case/derived/private/hardware-model.json",
      "revision": "sha256:hardware"
    },
    {
      "kind": "software_model",
      "path": "cases/synthetic-case/derived/private/components/y20/software-model.json",
      "revision": "sha256:software"
    },
    {
      "kind": "implementation_links",
      "path": "cases/synthetic-case/derived/private/components/y20/implementation-links.json",
      "revision": "sha256:links"
    },
    {
      "kind": "runtime_bindings",
      "path": "cases/synthetic-case/derived/private/components/y20/runtime-bindings.json",
      "revision": "sha256:bindings"
    }
  ],
  "safety_boundary": {
    "mode": "read_only_preflight",
    "state_changes_authorized": false,
    "limitations": [
      "Synthetic fixture; no live system was accessed."
    ]
  }
}
